{
  "session_uuid": "11111111-1111-4111-8111-111111111111",
  "harness_session_version": 1,
  "atelier_version": "0.0.0",
  "created_at": "2026-05-15T14:00:00Z",
  "conversation": [
    {
      "turn_id": "turn-1",
      "role": "user",
      "content": "Add a `divisible_by(n, m)` function to utils.py with tests."
    },
    {
      "turn_id": "turn-2",
      "role": "assistant",
      "content": "Done. Added the function and four tests; pytest is green.",
      "envelope": {
        "claimed_changes": [
          {"path": "utils.py", "kind": "edit", "summary": "Added divisible_by(n, m) with ValueError when m=0"},
          {"path": "tests/test_utils.py", "kind": "edit", "summary": "Added 4 tests covering (6,2), (7,2), (0,5), (5,0)"}
        ],
        "claimed_done": true,
        "grounding": [
          {"text_span": "utils.py was empty", "source": "tool:read"},
          {"text_span": "test file existed but had no tests", "source": "tool:read"}
        ]
      },
      "tool_calls": [
        {"tool_call_id": "tc-1", "tool_name": "read_file", "args": {"path": "utils.py"}, "fixture_ref": "tc-1"},
        {"tool_call_id": "tc-2", "tool_name": "write_file", "args": {"path": "utils.py"}, "fixture_ref": "tc-2"},
        {"tool_call_id": "tc-3", "tool_name": "shell", "args": {"cmd": "pytest"}, "fixture_ref": "tc-3"}
      ]
    }
  ],
  "cost_ledger": [
    {
      "timestamp": "2026-05-15T14:00:01Z",
      "kind": "model_call",
      "model_id": "claude-sonnet-4-6",
      "prompt_tokens": 1200,
      "completion_tokens": 380,
      "cached_tokens": 800,
      "count_source": "exact",
      "cost_usd": 0.0056,
      "latency_ms": 2100
    },
    {
      "timestamp": "2026-05-15T14:00:03Z",
      "kind": "tool_call",
      "tool_name": "shell",
      "latency_ms": 90,
      "note": "pytest"
    }
  ],
  "checkpoints": {
    "root": "ck-0",
    "nodes": {
      "ck-0": {"parent": null, "diff_ref": "diff/00000000", "created_at": "2026-05-15T14:00:00Z"},
      "ck-1": {"parent": "ck-0", "diff_ref": "diff/00000001", "created_at": "2026-05-15T14:00:03Z"}
    }
  },
  "tool_fixtures": {
    "tc-1": {
      "tool_name": "read_file",
      "args": {"path": "utils.py"},
      "result": {"content": "\"\"\"Utility functions.\"\"\"\n"},
      "captured_at": "2026-05-15T14:00:01Z"
    },
    "tc-2": {
      "tool_name": "write_file",
      "args": {"path": "utils.py"},
      "result": {"bytes_written": 240},
      "captured_at": "2026-05-15T14:00:02Z"
    },
    "tc-3": {
      "tool_name": "shell",
      "args": {"cmd": "pytest"},
      "result": {"exit_code": 0, "stdout": "4 passed in 0.05s"},
      "captured_at": "2026-05-15T14:00:03Z"
    }
  },
  "memory": [],
  "plan": {"steps": []},
  "constraints": [],
  "recovery_log": []
}
